[
  {
    "id": "aws_e800da86b39d212bf84a",
    "stationId": "awb_54b6c8797383e57c759c",
    "name": "Abdulbasit Abdulsamad",
    "country": "BJ",
    "url": "https://radio.mp3islam.com/listen/abdulbasit/radio.mp3",
    "codec": "aac",
    "bitrate": 192,
    "protocol": "https",
    "hls": false,
    "sources": [
      "radio-browser",
      "verified-radio-streams"
    ],
    "sourceIds": [
      "BJ:abdulbasit-abdulsamad",
      "ac937493-6836-4bf0-a632-fdb9bd80a232"
    ],
    "lastCheckOk": true,
    "lastCheckedAt": "2026-10-17T03:20:07Z"
  },
  {
    "id": "aws_8c14951c9f903202c5d0",
    "stationId": "awb_00de69d80599dbb1950e",
    "name": "ORTB Radio Bénin",
    "country": "BJ",
    "url": "https://listen.radioking.com/radio/47608/stream/84430",
    "codec": "mp3",
    "bitrate": 192,
    "protocol": "https",
    "hls": false,
    "sources": [
      "radio-browser",
      "verified-radio-streams"
    ],
    "sourceIds": [
      "79ac5dea-03c5-42a4-9195-4a26db00f65d",
      "BJ:ortb-radio-benin"
    ],
    "lastCheckOk": true,
    "lastCheckedAt": "2026-10-17T06:11:36Z"
  },
  {
    "id": "aws_467b91af05072450dee5",
    "stationId": "awb_d75b0c9264c5814b2b94",
    "name": "ORTB Radio Parakou",
    "country": "BJ",
    "url": "https://listen.radioking.com/radio/51919/stream/88927",
    "codec": "mp3",
    "bitrate": 128,
    "protocol": "https",
    "hls": false,
    "sources": [
      "radio-browser",
      "verified-radio-streams"
    ],
    "sourceIds": [
      "BJ:ortb-radio-parakou",
      "ceb2178c-34f3-4c5a-9dd6-0d9b60f28abf"
    ],
    "lastCheckOk": true,
    "lastCheckedAt": "2026-10-12T06:59:00Z"
  },
  {
    "id": "aws_f1261b06347db99b16cd",
    "stationId": "awb_8d9e448eed2077bc33da",
    "name": "Radio Cotonou 94.3",
    "country": "BJ",
    "url": "https://stream.zeno.fm/o9bspgm4y78vv",
    "codec": "mp3",
    "bitrate": 128,
    "protocol": "https",
    "hls": false,
    "sources": [
      "radio-browser"
    ],
    "sourceIds": [
      "666d0d87-f0fb-4b3b-8842-9753b817e3fd"
    ],
    "lastCheckOk": true,
    "lastCheckedAt": "2026-10-12T06:16:24Z"
  }
]
