[
  {
    "id": "aws_c9d4fa98a2dad20d65e6",
    "stationId": "awb_85e0b975d2786b4902c6",
    "name": "Abdulbasit Abdulsamad",
    "country": "PW",
    "url": "https://radio.mp3islam.com/listen/abdulbasit/radio.mp3",
    "codec": "aac",
    "bitrate": 64,
    "protocol": "https",
    "hls": false,
    "sources": [
      "radio-browser"
    ],
    "sourceIds": [
      "51af3757-66fb-47c3-ac91-9beb21995e5b"
    ],
    "lastCheckOk": true,
    "lastCheckedAt": "2026-10-12T04:16:22Z"
  },
  {
    "id": "aws_461c705eefaa81cf1762",
    "stationId": "awb_92c94874f971b19cba2c",
    "name": "UpBeat Radio",
    "country": "PW",
    "url": "https://live.upbeat.pw/",
    "codec": "mp3",
    "bitrate": 192,
    "protocol": "https",
    "hls": false,
    "sources": [
      "radio-browser"
    ],
    "sourceIds": [
      "51fa8080-c95e-4560-b1ce-5271a63cbaeb",
      "926025d8-6753-4185-8f10-764aa7b5766c"
    ],
    "lastCheckOk": true,
    "lastCheckedAt": "2026-10-12T04:16:22Z"
  },
  {
    "id": "aws_13b571af53e7bbfa0bd8",
    "stationId": "awb_a1ab7e77df0d748ed2f8",
    "name": "UpBeat.pw",
    "country": "PW",
    "url": "https://live.upbeat.pw/",
    "codec": "mp3",
    "bitrate": 192,
    "protocol": "https",
    "hls": false,
    "sources": [
      "radio-browser"
    ],
    "sourceIds": [
      "9ac434c6-1e25-47df-9d07-97a960ec2025"
    ],
    "lastCheckOk": true,
    "lastCheckedAt": "2026-10-12T14:23:07Z"
  }
]
