[
  {
    "id": "aws_fd80bc39e1e605d477f4",
    "stationId": "awb_5a8f36d66831fb087afb",
    "name": "89.7 Bay",
    "country": "MT",
    "url": "https://stream.v3.network/proxy/897bay/stream.mp3",
    "codec": "mp3",
    "bitrate": 256,
    "protocol": "https",
    "hls": false,
    "sources": [
      "radio-browser",
      "verified-radio-streams"
    ],
    "sourceIds": [
      "MT:89-7-bay",
      "d509b24b-d833-4617-b278-88eba4ee8287"
    ],
    "lastCheckOk": true,
    "lastCheckedAt": "2026-10-21T23:57:02Z"
  },
  {
    "id": "aws_7ae3c27fc8a63f27ecb5",
    "stationId": "awb_6587148e5d321c81d357",
    "name": "Abdulbasit Abdulsamad",
    "country": "MT",
    "url": "https://radio.mp3islam.com/listen/abdulbasit/radio.mp3",
    "codec": "aac",
    "bitrate": 192,
    "protocol": "https",
    "hls": false,
    "sources": [
      "radio-browser",
      "verified-radio-streams"
    ],
    "sourceIds": [
      "MT:abdulbasit-abdulsamad",
      "a72707ad-c97c-4901-8d30-fdfccab20c83"
    ],
    "lastCheckOk": true,
    "lastCheckedAt": "2026-10-22T13:12:39Z"
  },
  {
    "id": "aws_cd79ff95c73219fb95e5",
    "stationId": "awb_8325ce0a784849a5f2f1",
    "name": "Bay 89.7",
    "country": "MT",
    "url": "https://stream.v3.network/proxy/897bay/stream.mp3?_=1",
    "codec": "mp3",
    "bitrate": 256,
    "protocol": "https",
    "hls": false,
    "sources": [
      "radio-browser",
      "verified-radio-streams"
    ],
    "sourceIds": [
      "26df1ec1-d11b-4703-a4d2-07519b431b66",
      "MT:bay-89-7"
    ],
    "lastCheckOk": true,
    "lastCheckedAt": "2026-10-22T10:03:35Z"
  },
  {
    "id": "aws_3f58a325c87de8036fc4",
    "stationId": "awb_6125058101530dc28438",
    "name": "Bay Easy 100.2",
    "country": "MT",
    "url": "https://stream.v3.network/proxy/easy/stream.mp3",
    "codec": "mp3",
    "bitrate": 256,
    "protocol": "https",
    "hls": false,
    "sources": [
      "radio-browser",
      "verified-radio-streams"
    ],
    "sourceIds": [
      "5ae47396-1ba4-4b1d-92c7-bdc62d6f8879",
      "MT:bay-easy-100-2"
    ],
    "lastCheckOk": true,
    "lastCheckedAt": "2026-10-22T04:51:11Z"
  },
  {
    "id": "aws_ab39d1900c06fc270728",
    "stationId": "awb_d46ed030d1baecb1db63",
    "name": "Calypso Radio",
    "country": "MT",
    "url": "https://s4.radio.co/sf3aa4c25a/listen",
    "codec": "aac",
    "bitrate": 192,
    "protocol": "https",
    "hls": false,
    "sources": [
      "radio-browser",
      "verified-radio-streams"
    ],
    "sourceIds": [
      "MT:calypso-radio",
      "bc95a0d2-666d-400d-9d9b-bba9f50277b3"
    ],
    "lastCheckOk": true,
    "lastCheckedAt": "2026-10-22T21:48:09Z"
  },
  {
    "id": "aws_0a4071cbb7348ce6b16a",
    "stationId": "awb_cc97b0efc601cf9e4c4c",
    "name": "Campus 103.7",
    "country": "MT",
    "url": "https://campusfm.radioca.st/campusfm_live",
    "codec": "mp3",
    "bitrate": 192,
    "protocol": "https",
    "hls": false,
    "sources": [
      "radio-browser",
      "verified-radio-streams"
    ],
    "sourceIds": [
      "MT:campus-103-7",
      "b93e26d9-306c-4522-b420-cc4d537fc196"
    ],
    "lastCheckOk": true,
    "lastCheckedAt": "2026-10-22T21:31:10Z"
  },
  {
    "id": "aws_edc1a57728146f6ed660",
    "stationId": "awb_d3bac4ff069bc92c59f4",
    "name": "Christmas Radio Malta",
    "country": "MT",
    "url": "http://philae.shoutca.st:8402/stream?type=http&nocache=165",
    "codec": "mp3",
    "bitrate": 320,
    "protocol": "http",
    "hls": false,
    "sources": [
      "radio-browser"
    ],
    "sourceIds": [
      "5acaf6b3-101d-41c6-b3e8-c6d63bed8999"
    ],
    "lastCheckOk": true,
    "lastCheckedAt": "2026-10-22T18:31:11Z"
  },
  {
    "id": "aws_e8277853ec314a2fc06a",
    "stationId": "awb_8f55a595f736223465f9",
    "name": "Magic",
    "country": "MT",
    "url": "https://s46.myradiostream.com:6076/stream",
    "codec": "mp3",
    "bitrate": 128,
    "protocol": "https",
    "hls": false,
    "sources": [
      "radio-browser"
    ],
    "sourceIds": [
      "38f192a9-5cf9-419b-be7d-4d36c7409cc5"
    ],
    "lastCheckOk": true,
    "lastCheckedAt": "2026-10-22T13:02:24Z"
  },
  {
    "id": "aws_2b3357e3ad28f9482255",
    "stationId": "awb_091423e753d767ecd6fe",
    "name": "MALTIN BISS",
    "country": "MT",
    "url": "https://s4.voscast.com:8837/default",
    "codec": "mp3",
    "bitrate": 128,
    "protocol": "https",
    "hls": false,
    "sources": [
      "radio-browser",
      "verified-radio-streams"
    ],
    "sourceIds": [
      "MT:maltin-biss",
      "c1346103-8b8f-4960-bea9-5f86708a8ae8"
    ],
    "lastCheckOk": true,
    "lastCheckedAt": "2026-10-22T12:37:17Z"
  },
  {
    "id": "aws_67b78baeb9be1e46def0",
    "stationId": "awb_88b10077b65ab3044e7e",
    "name": "One Radio",
    "country": "MT",
    "url": "http://cdn.voscast.com/resources/?key=249f148a69ad7268c63c10098840e4d6&c=wmp",
    "codec": "unknown",
    "bitrate": 0,
    "protocol": "http",
    "hls": false,
    "sources": [
      "radio-browser"
    ],
    "sourceIds": [
      "450228f9-dff3-4924-aff1-d637135551aa"
    ],
    "lastCheckOk": true,
    "lastCheckedAt": "2026-10-22T00:49:22Z"
  },
  {
    "id": "aws_c14f900c79aba5ce42f6",
    "stationId": "awb_88b10077b65ab3044e7e",
    "name": "One Radio",
    "country": "MT",
    "url": "http://s10.voscast.com:8202/stream",
    "codec": "mp3",
    "bitrate": 128,
    "protocol": "http",
    "hls": false,
    "sources": [
      "radio-browser"
    ],
    "sourceIds": [
      "86d48e9f-ad97-4da1-a506-d82566b16ebf"
    ],
    "lastCheckOk": true,
    "lastCheckedAt": "2026-10-22T23:53:25Z"
  },
  {
    "id": "aws_3b21e908242ef64c0fdd",
    "stationId": "awb_04379ed3c2661ece5e6a",
    "name": "Radju Maria Malta",
    "country": "MT",
    "url": "http://dreamsiteradiocp.com:8102/",
    "codec": "mp3",
    "bitrate": 32,
    "protocol": "http",
    "hls": false,
    "sources": [
      "radio-browser"
    ],
    "sourceIds": [
      "179e2ab4-539e-11e8-a4d1-52543be04c81"
    ],
    "lastCheckOk": true,
    "lastCheckedAt": "2026-10-22T02:41:17Z"
  },
  {
    "id": "aws_1773d5a8d9ca38210d8c",
    "stationId": "awb_1215b07fe4ffdf25057c",
    "name": "RADJU MARIJA MALTA",
    "country": "MT",
    "url": "http://dreamsiteradiocp.com:8102/stream",
    "codec": "mp3",
    "bitrate": 32,
    "protocol": "http",
    "hls": false,
    "sources": [
      "radio-browser"
    ],
    "sourceIds": [
      "bc745d84-6996-11e9-af37-52543be04c81"
    ],
    "lastCheckOk": true,
    "lastCheckedAt": "2026-10-22T13:23:25Z"
  }
]
