[
  {
    "id": "aws_3e4eb9d8bdbf2c50dffe",
    "stationId": "awb_5bc8da2612419f7150ef",
    "name": "2020 Vision Radio",
    "country": "KN",
    "url": "http://perseus.shoutca.st:8218/;",
    "codec": "mp3",
    "bitrate": 320,
    "protocol": "http",
    "hls": false,
    "sources": [
      "radio-browser"
    ],
    "sourceIds": [
      "5b419f91-8bb8-4b1c-8b10-9e04a7eec245"
    ],
    "lastCheckOk": true,
    "lastCheckedAt": "2026-10-22T23:41:48Z"
  },
  {
    "id": "aws_30ae240c331c5ab29afe",
    "stationId": "awb_40f76a949a0486e839b6",
    "name": "Abdulbasit Abdulsamad",
    "country": "KN",
    "url": "https://radio.mp3islam.com/listen/abdulbasit/radio.mp3",
    "codec": "aac",
    "bitrate": 192,
    "protocol": "https",
    "hls": false,
    "sources": [
      "radio-browser",
      "verified-radio-streams"
    ],
    "sourceIds": [
      "1f122162-f390-4699-8135-2bdff6f3cb39",
      "KN:abdulbasit-abdulsamad"
    ],
    "lastCheckOk": true,
    "lastCheckedAt": "2026-10-22T22:58:28Z"
  },
  {
    "id": "aws_5ab5c6f19deb820250be",
    "stationId": "awb_0cc6917a9422873dbe8d",
    "name": "Sugar City 90.3 FM",
    "country": "KN",
    "url": "http://104.131.13.48:8000/radio.mp3",
    "codec": "mp3",
    "bitrate": 128,
    "protocol": "http",
    "hls": false,
    "sources": [
      "radio-browser"
    ],
    "sourceIds": [
      "13bb8871-5262-4549-83e7-4078bd3661cd"
    ],
    "lastCheckOk": true,
    "lastCheckedAt": "2026-10-22T18:41:13Z"
  },
  {
    "id": "aws_c1a9462faa3ec7dd11f6",
    "stationId": "awb_38bc9713953dfd278d6f",
    "name": "VON Radio",
    "country": "KN",
    "url": "http://vonradio.streamon.fm:8000/vonradio-24k.aac?type=.mp3/;stream.mp3",
    "codec": "aac",
    "bitrate": 96,
    "protocol": "http",
    "hls": false,
    "sources": [
      "radio-browser"
    ],
    "sourceIds": [
      "a1f15641-5778-11ea-be63-52543be04c81"
    ],
    "lastCheckOk": true,
    "lastCheckedAt": "2026-10-22T04:44:59Z"
  },
  {
    "id": "aws_3836ba20391399bc52b3",
    "stationId": "awb_53d5e5e246fd84eb3fec",
    "name": "ZIZ Radio",
    "country": "KN",
    "url": "http://media.slactech.com:8014/stream",
    "codec": "mp3",
    "bitrate": 64,
    "protocol": "http",
    "hls": false,
    "sources": [
      "radio-browser"
    ],
    "sourceIds": [
      "a2e1f5fa-0bbf-405f-8124-590cc1349cc7"
    ],
    "lastCheckOk": true,
    "lastCheckedAt": "2026-10-22T20:13:41Z"
  }
]
