[
  {
    "id": "aws_8af27ea63a553b2ce248",
    "stationId": "awb_aa3cee90182379aea613",
    "name": "Abdulbasit Abdulsamad",
    "country": "SC",
    "url": "https://radio.mp3islam.com/listen/abdulbasit/radio.mp3",
    "codec": "aac",
    "bitrate": 192,
    "protocol": "https",
    "hls": false,
    "sources": [
      "radio-browser",
      "verified-radio-streams"
    ],
    "sourceIds": [
      "66c0834a-d1d4-4cb5-8b0d-1b4fa6280dc7",
      "SC:abdulbasit-abdulsamad"
    ],
    "lastCheckOk": true,
    "lastCheckedAt": "2026-10-12T12:30:19Z"
  },
  {
    "id": "aws_1c75f7060a6d6e93ad64",
    "stationId": "awb_258390756b3da37a5dc3",
    "name": "Offshore Radio",
    "country": "SC",
    "url": "https://live.offshoreradio.net/listen/offshore_radio/radio.mp3",
    "codec": "mp3",
    "bitrate": 192,
    "protocol": "https",
    "hls": false,
    "sources": [
      "radio-browser"
    ],
    "sourceIds": [
      "1a62a959-f6d9-470e-b3ff-613318262b19"
    ],
    "lastCheckOk": true,
    "lastCheckedAt": "2026-10-12T19:02:19Z"
  },
  {
    "id": "aws_7e21f46a133ae4218952",
    "stationId": "awb_1c36a4e0e5a8ebae0fc2",
    "name": "SBC Paradise FM - Seychelles Best Mix",
    "country": "SC",
    "url": "https://streaming.fabrik.fm/paradise-fm/echocast/audio/index.m3u8",
    "codec": "unknown",
    "bitrate": 0,
    "protocol": "https",
    "hls": true,
    "sources": [
      "radio-browser"
    ],
    "sourceIds": [
      "18d9b902-3d2b-442a-8287-752fa3923340"
    ],
    "lastCheckOk": true,
    "lastCheckedAt": "2026-10-12T14:04:43Z"
  },
  {
    "id": "aws_aee3564c30a15e67d3d5",
    "stationId": "awb_bb94cbd5666dc56ccdb2",
    "name": "SBC Radyo Sesel",
    "country": "SC",
    "url": "https://streaming.fabrik.fm/radyo-sesel/echocast/audio/index.m3u8",
    "codec": "unknown",
    "bitrate": 0,
    "protocol": "https",
    "hls": true,
    "sources": [
      "radio-browser"
    ],
    "sourceIds": [
      "d3bbe416-883b-49e9-8200-ff7a7d37fb8e",
      "d5fa49c4-a20e-4ce3-a675-ea0f670a6ab6"
    ],
    "lastCheckOk": true,
    "lastCheckedAt": "2026-10-17T07:14:01Z"
  }
]
