[
  {
    "id": "aws_448da06a1f6c5f157cf1",
    "stationId": "awb_9134a4f390d94c0bc414",
    "name": "Abdulbasit Abdulsamad",
    "country": "SL",
    "url": "https://radio.mp3islam.com/listen/abdulbasit/radio.mp3",
    "codec": "aac",
    "bitrate": 64,
    "protocol": "https",
    "hls": false,
    "sources": [
      "radio-browser"
    ],
    "sourceIds": [
      "bde3d03d-6565-480b-a370-a2ac9c9a8551"
    ],
    "lastCheckOk": true,
    "lastCheckedAt": "2026-10-17T02:01:16Z"
  },
  {
    "id": "aws_846d22969d0bfd3e1293",
    "stationId": "awb_cb4c84109ba99da81341",
    "name": "Choice FM 93.3",
    "country": "SL",
    "url": "http://stream.zeno.fm/ct0gvk9149puv",
    "codec": "mp3",
    "bitrate": 128,
    "protocol": "http",
    "hls": false,
    "sources": [
      "radio-browser"
    ],
    "sourceIds": [
      "dbffe503-a05b-407c-bffd-c0b394c80f7d"
    ],
    "lastCheckOk": true,
    "lastCheckedAt": "2026-10-16T23:18:22Z"
  },
  {
    "id": "aws_ba78002cb64bed991d59",
    "stationId": "awb_a97142e24685bfea4bad",
    "name": "Sierra Network Radio",
    "country": "SL",
    "url": "http://45.79.181.148:8004/;",
    "codec": "mp3",
    "bitrate": 128,
    "protocol": "http",
    "hls": false,
    "sources": [
      "radio-browser"
    ],
    "sourceIds": [
      "e5962055-cc81-4b12-87cd-3e31244195fd",
      "f3cbe38a-5d84-4ad6-a1a5-ba263d4681b9"
    ],
    "lastCheckOk": true,
    "lastCheckedAt": "2026-10-12T16:35:00Z"
  }
]
