[
  {
    "id": "aws_fbfd00d22d106d132e70",
    "stationId": "awb_206d1be59da77e899d4a",
    "name": ".beautiful recitation",
    "country": "BH",
    "url": "https://qurango.net/radio/salma",
    "codec": "mp3",
    "bitrate": 128,
    "protocol": "https",
    "hls": false,
    "sources": [
      "radio-browser",
      "verified-radio-streams"
    ],
    "sourceIds": [
      "0857be2a-4c33-4f86-910c-0b97e2c83a65",
      "BH:beautiful-recitation"
    ],
    "lastCheckOk": true,
    "lastCheckedAt": "2026-10-26T23:15:37Z"
  },
  {
    "id": "aws_857fa1e6108918579a13",
    "stationId": "awb_2898cc19747eb74c44eb",
    "name": ".Quran",
    "country": "BH",
    "url": "https://backup.qurango.net/radio/ahmad_khader_altarabulsi",
    "codec": "mp3",
    "bitrate": 128,
    "protocol": "https",
    "hls": false,
    "sources": [
      "radio-browser"
    ],
    "sourceIds": [
      "45b6430d-53ae-41ed-857c-1bfe020f494c"
    ],
    "lastCheckOk": true,
    "lastCheckedAt": "2026-10-28T02:28:30Z"
  },
  {
    "id": "aws_d2c834d3b5a560c8820f",
    "stationId": "awb_d8d08793d30ff46dd7f8",
    "name": ".إذاعة ماهر المعيقلي",
    "country": "BH",
    "url": "https://backup.qurango.net/radio/maher",
    "codec": "mp3",
    "bitrate": 128,
    "protocol": "https",
    "hls": false,
    "sources": [
      "radio-browser"
    ],
    "sourceIds": [
      "3a424f70-7d7f-43a1-807f-9642b1e66792"
    ],
    "lastCheckOk": true,
    "lastCheckedAt": "2026-10-27T21:11:27Z"
  },
  {
    "id": "aws_1e03c54f612c8517cfc3",
    "stationId": "awb_1ac1996b8731fa705509",
    "name": ".القرآن",
    "country": "BH",
    "url": "https://backup.qurango.net/radio/ahmad_khader_altarabulsi",
    "codec": "mp3",
    "bitrate": 128,
    "protocol": "https",
    "hls": false,
    "sources": [
      "radio-browser",
      "verified-radio-streams"
    ],
    "sourceIds": [
      "3c8f72ed-5e58-4b9e-bf78-28a2bf4ae4b3",
      "BH:qurango-2"
    ],
    "lastCheckOk": true,
    "lastCheckedAt": "2026-10-26T22:05:04Z"
  },
  {
    "id": "aws_5cd03e663645a37a6ea9",
    "stationId": "awb_c04872056b71c49734a2",
    "name": "Abdulbasit Abdulsamad",
    "country": "BH",
    "url": "https://radio.mp3islam.com/listen/abdulbasit/radio.mp3",
    "codec": "mp3",
    "bitrate": 192,
    "protocol": "https",
    "hls": false,
    "sources": [
      "verified-radio-streams"
    ],
    "sourceIds": [
      "BH:abdulbasit-abdulsamad"
    ],
    "lastCheckOk": true,
    "lastCheckedAt": "2026-08-23"
  },
  {
    "id": "aws_bbaa2ea69961519c2711",
    "stationId": "awb_a50853a5eba0bdb69298",
    "name": "AFN 360 Bahrain",
    "country": "BH",
    "url": "http://25553.live.streamtheworld.com/AFNE_BHN_SC",
    "codec": "mp3",
    "bitrate": 96,
    "protocol": "http",
    "hls": false,
    "sources": [
      "radio-browser"
    ],
    "sourceIds": [
      "963c38d2-0601-11e8-ae97-52543be04c81"
    ],
    "lastCheckOk": true,
    "lastCheckedAt": "2026-10-27T01:08:34Z"
  },
  {
    "id": "aws_f20fcd52e52293a6be47",
    "stationId": "awb_7b2c39226272f5e23980",
    "name": "AFN GO BAHRAIN",
    "country": "BH",
    "url": "https://playerservices.streamtheworld.com/api/livestream-redirect/AFNE_BHNAAC.aac",
    "codec": "aac+",
    "bitrate": 32,
    "protocol": "https",
    "hls": false,
    "sources": [
      "radio-browser",
      "verified-radio-streams"
    ],
    "sourceIds": [
      "69459a0b-9f41-4f97-a54d-561e5e077442",
      "BH:afn-go-bahrain"
    ],
    "lastCheckOk": true,
    "lastCheckedAt": "2026-10-27T00:41:57Z"
  },
  {
    "id": "aws_d9c15362622333287bdf",
    "stationId": "awb_2faf19a518a66c52304b",
    "name": "Bahrain 106.1 FM",
    "country": "BH",
    "url": "https://5c7b683162943.streamlock.net/live/ngrp:radio-106-1_all/playlist.m3u8",
    "codec": "aac",
    "bitrate": 1066,
    "protocol": "https",
    "hls": true,
    "sources": [
      "radio-browser"
    ],
    "sourceIds": [
      "3e1a2014-d426-4f74-b237-8c109054911e"
    ],
    "lastCheckOk": true,
    "lastCheckedAt": "2026-10-27T04:31:24Z"
  },
  {
    "id": "aws_c74f5f154fe7dba1a53f",
    "stationId": "awb_549a67fe8f5767a3dee6",
    "name": "Bahrain FM 93.3",
    "country": "BH",
    "url": "https://5c7b683162943.streamlock.net/live/ngrp:radio-93-3_all/playlist.m3u8",
    "codec": "aac",
    "bitrate": 1066,
    "protocol": "https",
    "hls": true,
    "sources": [
      "radio-browser"
    ],
    "sourceIds": [
      "0b300680-fb8d-4a73-a05b-76f669cd8881"
    ],
    "lastCheckOk": true,
    "lastCheckedAt": "2026-10-27T15:49:11Z"
  },
  {
    "id": "aws_e08547a3c37876664a96",
    "stationId": "awb_794633a2f303ec1f1cc6",
    "name": "Bahrain Quran 106.1 FM",
    "country": "BH",
    "url": "https://5c7b683162943.streamlock.net/live/ngrp:radio-106-1_all/playlist.m3u8",
    "codec": "aac",
    "bitrate": 1066,
    "protocol": "https",
    "hls": true,
    "sources": [
      "radio-browser"
    ],
    "sourceIds": [
      "952840ba-f2d8-42ca-9e5f-7e169b880c8c"
    ],
    "lastCheckOk": true,
    "lastCheckedAt": "2026-10-27T22:21:46Z"
  },
  {
    "id": "aws_62933f13238d9bfc2ba9",
    "stationId": "awb_8a3e7ed5dbeb62f7455a",
    "name": "ccc",
    "country": "BH",
    "url": "https://m-aac.cbs.co.kr/mweb_cbs939/_definst_/cbs939.stream/playlist.m3u8",
    "codec": "aac",
    "bitrate": 98,
    "protocol": "https",
    "hls": true,
    "sources": [
      "radio-browser"
    ],
    "sourceIds": [
      "667f8de8-cd59-4016-9f54-e55fb13e2491"
    ],
    "lastCheckOk": true,
    "lastCheckedAt": "2026-10-27T21:22:18Z"
  },
  {
    "id": "aws_5a4880bb74d014a19c99",
    "stationId": "awb_b065d36804b9c05ecb56",
    "name": "Live FM",
    "country": "BH",
    "url": "https://stream.aiir.com/dbv0rxpwp6ytv",
    "codec": "aac",
    "bitrate": 320,
    "protocol": "https",
    "hls": false,
    "sources": [
      "radio-browser"
    ],
    "sourceIds": [
      "09cf6598-9899-4ff3-bb90-25bd517b7375",
      "104dc6c9-bfe7-464b-bf4f-e485a921c109"
    ],
    "lastCheckOk": true,
    "lastCheckedAt": "2026-10-28T01:37:47Z"
  },
  {
    "id": "aws_d66529ba664a93fd3cb4",
    "stationId": "awb_4234f9f8cb4aee27f783",
    "name": "Monte Carlo Doualiya",
    "country": "BH",
    "url": "https://montecarlodoualiya128k.ice.infomaniak.ch/mc-doualiya.mp3",
    "codec": "mp3",
    "bitrate": 128,
    "protocol": "https",
    "hls": false,
    "sources": [
      "radio-browser",
      "verified-radio-streams"
    ],
    "sourceIds": [
      "58b9b6e3-f638-4467-993c-71e6345435f0",
      "BH:monte-carlo-doualiya"
    ],
    "lastCheckOk": true,
    "lastCheckedAt": "2026-10-27T03:39:13Z"
  },
  {
    "id": "aws_3c31b7331290d4d1e45d",
    "stationId": "awb_8f68692463ed18fd7ca6",
    "name": "Panorama FM",
    "country": "BH",
    "url": "https://shls-panoramafm-prod-dub.shahid.net/out/v1/66262e420d824475aaae794dc2d69f14/index.m3u8",
    "codec": "aac",
    "bitrate": 348,
    "protocol": "https",
    "hls": true,
    "sources": [
      "radio-browser"
    ],
    "sourceIds": [
      "17bae22b-590b-4ce1-8bee-4a1c66277a60"
    ],
    "lastCheckOk": true,
    "lastCheckedAt": "2026-10-27T23:55:06Z"
  },
  {
    "id": "aws_3bfa25ea4a4772085b05",
    "stationId": "awb_8feaf12f79608dd9d3a2",
    "name": "Traditional Radio 95.0",
    "country": "BH",
    "url": "https://5c7b683162943.streamlock.net/live/ngrp:radio-95-0_all/chunklist_w1641860732_b981072.m3u8",
    "codec": "unknown",
    "bitrate": 0,
    "protocol": "https",
    "hls": true,
    "sources": [
      "radio-browser"
    ],
    "sourceIds": [
      "b35b9f40-86b2-4686-852c-12190c252e87"
    ],
    "lastCheckOk": true,
    "lastCheckedAt": "2026-10-27T09:40:29Z"
  },
  {
    "id": "aws_94b2531c2d1057103b81",
    "stationId": "awb_0a04a2178e64923ef29e",
    "name": "Voice of Ummah",
    "country": "BH",
    "url": "http://mediati.me/radio/8010/radio.mp3",
    "codec": "mp3",
    "bitrate": 32,
    "protocol": "http",
    "hls": false,
    "sources": [
      "radio-browser"
    ],
    "sourceIds": [
      "c1060a60-4794-42c2-af3f-0f0d8046a8a1"
    ],
    "lastCheckOk": true,
    "lastCheckedAt": "2026-10-27T18:20:38Z"
  },
  {
    "id": "aws_d44e65c3949a2c678870",
    "stationId": "awb_7efec32d8e0c82e8f847",
    "name": "إذاعة القرآن الكريم",
    "country": "BH",
    "url": "https://n0a.radiojar.com/0tpy1h0kxtzuv?rj-ttl=5&rj-tok=AAABhdgGORQA-2acfyF3_4WY2g",
    "codec": "mp3",
    "bitrate": 0,
    "protocol": "https",
    "hls": false,
    "sources": [
      "verified-radio-streams"
    ],
    "sourceIds": [
      "BH:radiojar"
    ],
    "lastCheckOk": true,
    "lastCheckedAt": "2026-08-23"
  },
  {
    "id": "aws_dfb65c9b3cfa5753bfa2",
    "stationId": "awb_4ec183d388ead5967497",
    "name": "تفسير بن عثيمين رحمه الله",
    "country": "BH",
    "url": "https://qurango.net/radio/tafseer",
    "codec": "mp3",
    "bitrate": 128,
    "protocol": "https",
    "hls": false,
    "sources": [
      "radio-browser",
      "verified-radio-streams"
    ],
    "sourceIds": [
      "4eb8cc87-f04a-41e0-9498-c88afc2309f3",
      "BH:qurango"
    ],
    "lastCheckOk": true,
    "lastCheckedAt": "2026-10-28T01:05:27Z"
  }
]
