[
  {
    "id": "aws_8e5a60f5f71f4dbb4981",
    "stationId": "awb_49dbca638a727a7d9422",
    "name": "Abdulbasit Abdulsamad",
    "country": "PF",
    "url": "https://radio.mp3islam.com/listen/abdulbasit/radio.mp3",
    "codec": "aac",
    "bitrate": 192,
    "protocol": "https",
    "hls": false,
    "sources": [
      "radio-browser",
      "verified-radio-streams"
    ],
    "sourceIds": [
      "PF:abdulbasit-abdulsamad",
      "d69e0345-3e2e-4442-ac4a-2ea1a86faf85"
    ],
    "lastCheckOk": true,
    "lastCheckedAt": "2026-10-22T21:17:56Z"
  },
  {
    "id": "aws_5c8fa2fe299ad3a56f07",
    "stationId": "awb_2228c8052431e49cbb2b",
    "name": "HITI FM",
    "country": "PF",
    "url": "http://n0a.radiojar.com/u0yz7p0mb.mp3",
    "codec": "mp3",
    "bitrate": 0,
    "protocol": "http",
    "hls": false,
    "sources": [
      "radio-browser"
    ],
    "sourceIds": [
      "97daf697-6aec-48cd-8aa0-d300ecc3885d"
    ],
    "lastCheckOk": true,
    "lastCheckedAt": "2026-10-22T11:27:00Z"
  },
  {
    "id": "aws_b89d3988856272f7cfce",
    "stationId": "awb_f5519376cdda88334356",
    "name": "Hiti FM",
    "country": "PF",
    "url": "https://n01.radiojar.com/u0yz7p0mb.mp3",
    "codec": "mp3",
    "bitrate": 0,
    "protocol": "https",
    "hls": false,
    "sources": [
      "radio-browser",
      "verified-radio-streams"
    ],
    "sourceIds": [
      "PF:hiti-fm",
      "c06d6586-9fa8-49cf-9731-7c582430a588"
    ],
    "lastCheckOk": true,
    "lastCheckedAt": "2026-10-27T03:08:21Z"
  },
  {
    "id": "aws_dec5d6e88600b5077f66",
    "stationId": "awb_1d7937d18b1a22988cd1",
    "name": "Nostalgie 100% Francais 80",
    "country": "PF",
    "url": "https://streaming.nrjaudio.fm/out2976ubafg?origine=playernostalgie&aw_0_req.userConsentV2=CQkCxgAQkCxgAAHABBENCdFsAP_gAEPgAAqIJ2tR_G_fbWlj-TZ1YbpkeYwP99gj7sQxBgSJk24FyJvW7JwCx2ExJAzapqIKmRIAu3TBAQNlGIDURUAAIIgFqSDMaESUgTNKJ6BEiFMRI2JQCFxvm4FDeQCY4kp_9kcxmB-t7dr8yNzgAgAAAUCAIAAgAIABAACIAAAgAAAAAQAAAiwACAAAAAAAAEAAAFAAAABAAAEAAAACAAAABAAAIJ2gAmGhUQQlgQCBAoCAECAAQVhABQIAgAASBggIASBgQ5AwAXWEyAAAKAAYIAQAAgwABAAAJAAhEAEABAIAQIBAIAAQAAAAIACBAADABQiAQAAgOgYBAQQCBYAJEZUBpgQgAJBASyFCAAAAgAACAAAAAAIAAAAAAAAAgAAAAAAAAggAAAAAAAAAAAEAAAAAAEABAAAAAAAAAAAAABAAAIAA.IJ2tR_G_fbWlj-TZ14bpkeYwf99gj7sQxBgSJk24FyJvW7JwC32EzJAzapqYKmRIAu3TBAQNtGIjURUABIIgVqTDMaESUgTNKJ6BEiHMRY2JQCFxvm4FDeQCZ4kp_90d5mR-t7dr-yNzgAgAgAUCAIAAgAIABAACIAAAgAAAAAQAAgiwACAAAAAAAAEAAAFAAEABAAAEAAAACAAAABAAAIAA.f_wACHwAAAAA&aw_0_1st.station=Nostalgie-100-Francais-80",
    "codec": "aac+",
    "bitrate": 128,
    "protocol": "https",
    "hls": false,
    "sources": [
      "radio-browser",
      "verified-radio-streams"
    ],
    "sourceIds": [
      "6aadb9d6-6a51-4ffe-998c-c05ca0608991",
      "PF:nostalgie-100-francais-80"
    ],
    "lastCheckOk": true,
    "lastCheckedAt": "2026-10-22T23:46:56Z"
  },
  {
    "id": "aws_ad3b4bbf37799b3c54fe",
    "stationId": "awb_374dfd4ff643fd8e00a4",
    "name": "Polynésie 1ère",
    "country": "PF",
    "url": "https://polynesie.ice.infomaniak.ch/polynesie-128.mp3",
    "codec": "mp3",
    "bitrate": 128,
    "protocol": "https",
    "hls": false,
    "sources": [
      "radio-browser",
      "verified-radio-streams"
    ],
    "sourceIds": [
      "5c5beb65-ef62-4730-ac64-b3b24e046620",
      "PF:polynesie-1ere"
    ],
    "lastCheckOk": true,
    "lastCheckedAt": "2026-10-27T00:48:15Z"
  },
  {
    "id": "aws_c4155b92e0184ff09032",
    "stationId": "awb_b7d9d78e6a384bb3d69c",
    "name": "Polynesie Première",
    "country": "PF",
    "url": "https://polynesie.ice.infomaniak.ch/polynesie-128.mp3",
    "codec": "mp3",
    "bitrate": 128,
    "protocol": "https",
    "hls": false,
    "sources": [
      "radio-browser"
    ],
    "sourceIds": [
      "e1e860be-ffd2-4509-8e32-89e97e3513c3"
    ],
    "lastCheckOk": true,
    "lastCheckedAt": "2026-10-23T00:11:50Z"
  },
  {
    "id": "aws_1547863ce1b41101b5a8",
    "stationId": "awb_68431686305f1bdd4b15",
    "name": "Radio 1 PF",
    "country": "PF",
    "url": "https://live.radio1.pf:8443/radio1",
    "codec": "aac+",
    "bitrate": 320,
    "protocol": "https",
    "hls": false,
    "sources": [
      "radio-browser",
      "verified-radio-streams"
    ],
    "sourceIds": [
      "11f87095-84e8-48cd-8060-554f6d9ca526",
      "PF:radio-1-pf"
    ],
    "lastCheckOk": true,
    "lastCheckedAt": "2026-10-22T20:39:21Z"
  },
  {
    "id": "aws_109bead33d81b1ec0baf",
    "stationId": "awb_24986ca135f35d59cbef",
    "name": "Radio 1 Tahiti",
    "country": "PF",
    "url": "http://live.radio1.pf:8001/radio1",
    "codec": "aac+",
    "bitrate": 320,
    "protocol": "http",
    "hls": false,
    "sources": [
      "radio-browser"
    ],
    "sourceIds": [
      "605e7007-4427-486d-8d30-48545df6ecde"
    ],
    "lastCheckOk": true,
    "lastCheckedAt": "2026-10-22T08:47:43Z"
  },
  {
    "id": "aws_7a55f067df8619819656",
    "stationId": "awb_40399169756d1ba8f164",
    "name": "Radio Melod'iles",
    "country": "PF",
    "url": "http://uk25freenew.listen2myradio.com:7545/",
    "codec": "mp3",
    "bitrate": 128,
    "protocol": "http",
    "hls": false,
    "sources": [
      "radio-browser"
    ],
    "sourceIds": [
      "796bfdf1-efcd-47ec-bd94-1c50bbfcba71"
    ],
    "lastCheckOk": true,
    "lastCheckedAt": "2026-10-23T00:54:39Z"
  },
  {
    "id": "aws_1099c6b04ad0cbb848e1",
    "stationId": "awb_fc8e8c99cb47183918bd",
    "name": "Radio1 Tahiti",
    "country": "PF",
    "url": "https://live.radio1.pf:8443/radio1",
    "codec": "aac+",
    "bitrate": 320,
    "protocol": "https",
    "hls": false,
    "sources": [
      "radio-browser"
    ],
    "sourceIds": [
      "56825315-02bd-4cfb-b5da-bf516f75a139"
    ],
    "lastCheckOk": true,
    "lastCheckedAt": "2026-10-27T07:17:58Z"
  },
  {
    "id": "aws_f7a5934c12c551d7d165",
    "stationId": "awb_7df80402e695d83ab937",
    "name": "Tiare FM",
    "country": "PF",
    "url": "https://live.tiarefm.pf:8443/tiarefm",
    "codec": "mp3",
    "bitrate": 128,
    "protocol": "https",
    "hls": false,
    "sources": [
      "radio-browser",
      "verified-radio-streams"
    ],
    "sourceIds": [
      "1c07a1b8-b380-4403-a985-53948874b763",
      "PF:tiare-fm"
    ],
    "lastCheckOk": true,
    "lastCheckedAt": "2026-10-22T21:59:37Z"
  }
]
