[
  {
    "id": "aws_4bd5ac48184d7132361e",
    "stationId": "awb_90b0d518b80f663878eb",
    "name": "Tropik FM Live From St Barth",
    "country": "MF",
    "url": "https://stream10.vestaradio.com/TROPIKFM",
    "codec": "mp3",
    "bitrate": 128,
    "protocol": "https",
    "hls": false,
    "sources": [
      "radio-browser"
    ],
    "sourceIds": [
      "2fe208a9-07ac-412b-9b31-80a803070e46"
    ],
    "lastCheckOk": true,
    "lastCheckedAt": "2026-10-17T16:26:17Z"
  }
]
