[
  {
    "id": "aws_52199060e10bbefe8f0f",
    "stationId": "awb_3ee2761001b4bc4cd469",
    "name": "Abdulbasit Abdulsamad",
    "country": "AS",
    "url": "https://radio.mp3islam.com/listen/abdulbasit/radio.mp3",
    "codec": "aac",
    "bitrate": 192,
    "protocol": "https",
    "hls": false,
    "sources": [
      "radio-browser",
      "verified-radio-streams"
    ],
    "sourceIds": [
      "41846536-292f-4304-be91-f2f9c2d7cd84",
      "AS:abdulbasit-abdulsamad"
    ],
    "lastCheckOk": true,
    "lastCheckedAt": "2026-10-27T08:39:57Z"
  },
  {
    "id": "aws_670e308e168bca078ff2",
    "stationId": "awb_50857afa5e19bc7c6381",
    "name": "Christmas 356 Santa's Radio",
    "country": "AS",
    "url": "https://us3.streamingpulse.com/ssl/7038",
    "codec": "mp3",
    "bitrate": 128,
    "protocol": "https",
    "hls": false,
    "sources": [
      "radio-browser",
      "verified-radio-streams"
    ],
    "sourceIds": [
      "7eb65cc2-7d74-4026-817d-882b92462e7d",
      "AS:christmas-356-santa-s-radio"
    ],
    "lastCheckOk": true,
    "lastCheckedAt": "2026-10-26T22:33:07Z"
  },
  {
    "id": "aws_c617e329a43aa7ed4bd2",
    "stationId": "awb_8cb6db1d1c1b255a2da8",
    "name": "Christmas Classics",
    "country": "AS",
    "url": "http://listen.181fm.com/181-xtraditional_128k.mp3?listenerId=esAdblock074493&aw_0_1st.playerid=esPlayer&aw_0_1st.skey=1669379836",
    "codec": "mp3",
    "bitrate": 128,
    "protocol": "http",
    "hls": false,
    "sources": [
      "radio-browser"
    ],
    "sourceIds": [
      "40c04d08-c2f0-419a-8103-66ed68105cba",
      "c76649db-9464-4c20-af1b-9c0e01004680"
    ],
    "lastCheckOk": true,
    "lastCheckedAt": "2026-10-22T19:37:12Z"
  },
  {
    "id": "aws_7d32d51299b5faa9f5de",
    "stationId": "awb_6a5a822cfceb02695d31",
    "name": "EXA FM: Pop musika i le Igilisi ma le Sipaniolo",
    "country": "AS",
    "url": "https://playerservices.streamtheworld.com/api/livestream-redirect/XHPSFMAAC.aac",
    "codec": "aac+",
    "bitrate": 48,
    "protocol": "https",
    "hls": false,
    "sources": [
      "radio-browser",
      "verified-radio-streams"
    ],
    "sourceIds": [
      "AS:exa-fm-pop-musika-i-le-igilisi-ma-le-sipaniolo",
      "ed08409b-0828-4e2d-be38-8e317ec61de8"
    ],
    "lastCheckOk": true,
    "lastCheckedAt": "2026-10-27T00:03:48Z"
  },
  {
    "id": "aws_659e33acdde01af9c52d",
    "stationId": "awb_055800d6d05f409b973e",
    "name": "Fm Christmas classics",
    "country": "AS",
    "url": "https://listen.181fm.com/181-xtraditional_128k.mp3",
    "codec": "mp3",
    "bitrate": 128,
    "protocol": "https",
    "hls": false,
    "sources": [
      "radio-browser",
      "verified-radio-streams"
    ],
    "sourceIds": [
      "101c0368-d755-462b-805d-f226d2e8f2be",
      "AS:fm-christmas-classics"
    ],
    "lastCheckOk": true,
    "lastCheckedAt": "2026-10-22T15:45:03Z"
  },
  {
    "id": "aws_973ba411b385b48216b2",
    "stationId": "awb_759facc5710e72419d8f",
    "name": "Fox news",
    "country": "AS",
    "url": "https://247preview.foxnews.com/hls/live/2020027/fncv3preview/primary.m3u8",
    "codec": "unknown",
    "bitrate": 311,
    "protocol": "https",
    "hls": true,
    "sources": [
      "radio-browser"
    ],
    "sourceIds": [
      "4b1c00b7-53ef-4168-bf8e-1a0fa6a9298c"
    ],
    "lastCheckOk": true,
    "lastCheckedAt": "2026-10-22T17:34:17Z"
  },
  {
    "id": "aws_fe8df181779cf414661a",
    "stationId": "awb_16cb614c533acb945358",
    "name": "LOVE FM: Musika lauiloa i le gagana Sipaniolo",
    "country": "AS",
    "url": "https://mdstrm.com/audio/66a01759c5aa2b85d66b5933/live.m3u8",
    "codec": "aac",
    "bitrate": 98,
    "protocol": "https",
    "hls": true,
    "sources": [
      "radio-browser"
    ],
    "sourceIds": [
      "f324e19f-db31-4e76-98c5-a2f00b4357cf"
    ],
    "lastCheckOk": true,
    "lastCheckedAt": "2026-10-22T18:43:11Z"
  },
  {
    "id": "aws_578e55ddfcda7954432e",
    "stationId": "awb_c4d7ceaa298181715d30",
    "name": "National Public Radio",
    "country": "AS",
    "url": "https://npr-ice.streamguys1.com/live.mp3",
    "codec": "mp3",
    "bitrate": 96,
    "protocol": "https",
    "hls": false,
    "sources": [
      "radio-browser",
      "verified-radio-streams"
    ],
    "sourceIds": [
      "3250a8a8-8697-4aa7-9710-ea1141e846bd",
      "AS:national-public-radio"
    ],
    "lastCheckOk": true,
    "lastCheckedAt": "2026-10-27T00:03:48Z"
  },
  {
    "id": "aws_ca26ab0419e8fa34529e",
    "stationId": "awb_f2c9252b13a9c7b958b5",
    "name": "Planet black",
    "country": "AS",
    "url": "http://mp3.planetradio.de/plrchannels/hqblackbeats.aac",
    "codec": "aac+",
    "bitrate": 128,
    "protocol": "http",
    "hls": false,
    "sources": [
      "radio-browser"
    ],
    "sourceIds": [
      "103b2fad-e64a-4859-b1f7-30e519f809db"
    ],
    "lastCheckOk": true,
    "lastCheckedAt": "2026-10-22T22:38:54Z"
  },
  {
    "id": "aws_ac85e193f7b8ad7ddc7e",
    "stationId": "awb_d177eb3ea464fa91ca3b",
    "name": "Radio Rashi online",
    "country": "AS",
    "url": "https://s2.free-shoutcast.com/stream/18214",
    "codec": "mp3",
    "bitrate": 128,
    "protocol": "https",
    "hls": false,
    "sources": [
      "radio-browser"
    ],
    "sourceIds": [
      "992a81a6-5007-43f7-90c4-b823d5849d70"
    ],
    "lastCheckOk": true,
    "lastCheckedAt": "2026-10-22T19:11:33Z"
  },
  {
    "id": "aws_aeef2cadfdaf7a6c9abb",
    "stationId": "awb_f6a49f1216b2cc36f365",
    "name": "S1lhoutte - Rock FM",
    "country": "AS",
    "url": "http://rockfm.rockfm.com.tr:9450/",
    "codec": "aac+",
    "bitrate": 128,
    "protocol": "http",
    "hls": false,
    "sources": [
      "radio-browser"
    ],
    "sourceIds": [
      "3860273c-7ff0-4277-b612-2ea21a8cccbe"
    ],
    "lastCheckOk": true,
    "lastCheckedAt": "2026-10-22T12:47:07Z"
  },
  {
    "id": "aws_60f7a235b5a7e99b85c3",
    "stationId": "awb_e55a1d30216b8713784c",
    "name": "WMIL 106.1 FM",
    "country": "AS",
    "url": "https://stream.revma.ihrhls.com/zc2677/hls.m3u8?streamid=2677",
    "codec": "aac",
    "bitrate": 24,
    "protocol": "https",
    "hls": true,
    "sources": [
      "radio-browser"
    ],
    "sourceIds": [
      "4c23b51d-c99a-42b9-8b47-eed44cebbf7c"
    ],
    "lastCheckOk": true,
    "lastCheckedAt": "2026-10-22T15:56:26Z"
  },
  {
    "id": "aws_ac8ffecbe61c710e7f3b",
    "stationId": "awb_29c10ce49e310fe4c04f",
    "name": "Youtube",
    "country": "AS",
    "url": "http://listen.181fm.com/181-xtraditional_128k.mp3?listenerId=esAdblock074493&aw_0_1st.playerid=esPlayer&aw_0_1st.skey=1669379836",
    "codec": "mp3",
    "bitrate": 128,
    "protocol": "http",
    "hls": false,
    "sources": [
      "radio-browser"
    ],
    "sourceIds": [
      "339c6a61-4433-44f9-9fad-20998c512ae4"
    ],
    "lastCheckOk": true,
    "lastCheckedAt": "2026-10-22T11:57:38Z"
  },
  {
    "id": "aws_551230248bd65ea6809e",
    "stationId": "awb_fea1739236910183740a",
    "name": "Радио Раши",
    "country": "AS",
    "url": "https://s2.free-shoutcast.com/stream/18214",
    "codec": "mp3",
    "bitrate": 128,
    "protocol": "https",
    "hls": false,
    "sources": [
      "radio-browser"
    ],
    "sourceIds": [
      "6ea9efd5-d3e6-405d-8190-96f7abed1826"
    ],
    "lastCheckOk": true,
    "lastCheckedAt": "2026-10-22T23:17:02Z"
  },
  {
    "id": "aws_9f233bb1b55c384c4b9a",
    "stationId": "awb_f685b481d3bee6c44dbc",
    "name": "希望之声",
    "country": "AS",
    "url": "https://livecast1.soundofhope.org:2087/soh-live",
    "codec": "mp3",
    "bitrate": 128,
    "protocol": "https",
    "hls": false,
    "sources": [
      "radio-browser",
      "verified-radio-streams"
    ],
    "sourceIds": [
      "AS:soundofhope",
      "ce6dc5a4-a2b5-433f-9912-a01d56f49de6"
    ],
    "lastCheckOk": true,
    "lastCheckedAt": "2026-10-23T01:06:15Z"
  }
]
