[
  {
    "id": "aws_5db27ade7678bf8a7712",
    "stationId": "awb_208298264916cea7638b",
    "name": "Abdulbasit Abdulsamad",
    "country": "GD",
    "url": "https://radio.mp3islam.com/listen/abdulbasit/radio.mp3",
    "codec": "aac",
    "bitrate": 192,
    "protocol": "https",
    "hls": false,
    "sources": [
      "radio-browser",
      "verified-radio-streams"
    ],
    "sourceIds": [
      "GD:abdulbasit-abdulsamad",
      "ae66e1eb-b0ce-4363-9ac4-16af31adda27"
    ],
    "lastCheckOk": true,
    "lastCheckedAt": "2026-10-17T16:50:25Z"
  },
  {
    "id": "aws_b66523c9000170fd686c",
    "stationId": "awb_1583bc534d37046502f4",
    "name": "Boss FM 104.1-104.9 - Grenada",
    "country": "GD",
    "url": "https://usa8.fastcast4u.com/proxy/bossfm2?mp=/1",
    "codec": "mp3",
    "bitrate": 128,
    "protocol": "https",
    "hls": false,
    "sources": [
      "radio-browser",
      "verified-radio-streams"
    ],
    "sourceIds": [
      "GD:boss-fm-104-1-104-9-grenada",
      "dbfd0142-0a08-4342-b66f-54838a6e1ea2"
    ],
    "lastCheckOk": true,
    "lastCheckedAt": "2026-10-17T23:29:49Z"
  },
  {
    "id": "aws_fb7b0f1afefbfeb49b3b",
    "stationId": "awb_244af1f338eddfac1f83",
    "name": "Hot Shotz Radio - Grenada",
    "country": "GD",
    "url": "http://usa1.fastcast4u.com:3292/stream",
    "codec": "mp3",
    "bitrate": 128,
    "protocol": "http",
    "hls": false,
    "sources": [
      "radio-browser"
    ],
    "sourceIds": [
      "68d8a2ac-2d16-4f6c-a18a-30b4ba0a9bd6"
    ],
    "lastCheckOk": true,
    "lastCheckedAt": "2026-10-17T19:59:51Z"
  },
  {
    "id": "aws_0f74d9956105aeafc115",
    "stationId": "awb_05c6cf1f27a7eb187c43",
    "name": "Star FM 101.9",
    "country": "GD",
    "url": "https://starchild.radioca.st/",
    "codec": "mp3",
    "bitrate": 128,
    "protocol": "https",
    "hls": false,
    "sources": [
      "radio-browser"
    ],
    "sourceIds": [
      "a347aba6-4247-4b97-bc4f-ba90c3d1c380"
    ],
    "lastCheckOk": true,
    "lastCheckedAt": "2026-10-17T21:24:03Z"
  },
  {
    "id": "aws_cad1608df458bdd42113",
    "stationId": "awb_f7761230012bb1df731f",
    "name": "Star FM 101.9 Grenada",
    "country": "GD",
    "url": "http://176.9.7.145:8288/stream",
    "codec": "mp3",
    "bitrate": 128,
    "protocol": "http",
    "hls": false,
    "sources": [
      "radio-browser"
    ],
    "sourceIds": [
      "fd0fc4b3-3d76-41c5-b98a-f01356e67b83"
    ],
    "lastCheckOk": true,
    "lastCheckedAt": "2026-10-17T20:47:52Z"
  },
  {
    "id": "aws_b95ac4108fa59a35eefb",
    "stationId": "awb_75af84fe8d38207f3e6c",
    "name": "Wee FM 93.3/93.9 - Grenada",
    "country": "GD",
    "url": "https://usa8.fastcast4u.com/proxy/weefm2?mp=/1",
    "codec": "mp3",
    "bitrate": 128,
    "protocol": "https",
    "hls": false,
    "sources": [
      "radio-browser",
      "verified-radio-streams"
    ],
    "sourceIds": [
      "9c2c5d0e-89ac-4231-8995-ffc01047ce77",
      "GD:wee-fm-93-3-93-9-grenada"
    ],
    "lastCheckOk": true,
    "lastCheckedAt": "2026-10-16T22:37:16Z"
  }
]
