[
  {
    "id": "aws_f45dd8148858d46f568c",
    "stationId": "awb_f8ca05c340def4d2ae20",
    "name": "📻 Radio Shatta Movement",
    "country": "GP",
    "url": "https://stream-178.zeno.fm/pbnss8oxyluuv",
    "codec": "mp3",
    "bitrate": 128,
    "protocol": "https",
    "hls": false,
    "sources": [
      "radio-browser"
    ],
    "sourceIds": [
      "7d827f0e-85bc-4601-80d4-77d4391f60cf"
    ],
    "lastCheckOk": true,
    "lastCheckedAt": "2026-10-27T02:44:18Z"
  },
  {
    "id": "aws_f0f3ef268b422847cc28",
    "stationId": "awb_3536eb4938ffc1ff9079",
    "name": "Abdulbasit Abdulsamad",
    "country": "GP",
    "url": "https://radio.mp3islam.com/listen/abdulbasit/radio.mp3",
    "codec": "mp3",
    "bitrate": 192,
    "protocol": "https",
    "hls": false,
    "sources": [
      "verified-radio-streams"
    ],
    "sourceIds": [
      "GP:abdulbasit-abdulsamad"
    ],
    "lastCheckOk": true,
    "lastCheckedAt": "2026-08-23"
  },
  {
    "id": "aws_9b0d2e78fbb9092ec035",
    "stationId": "awb_f4e275c39ee6debb2339",
    "name": "Antilles Média - Kompa Gold",
    "country": "GP",
    "url": "https://antillesmedia.pro-fhi.net/antillesmediakompa",
    "codec": "mp3",
    "bitrate": 128,
    "protocol": "https",
    "hls": false,
    "sources": [
      "radio-browser",
      "verified-radio-streams"
    ],
    "sourceIds": [
      "7e9e4c3f-9692-4c62-af52-6437ad9cbbc1",
      "GP:antilles-media-kompa-gold"
    ],
    "lastCheckOk": true,
    "lastCheckedAt": "2026-10-28T01:11:09Z"
  },
  {
    "id": "aws_9ffff8e3cdd27c747ede",
    "stationId": "awb_44c39e858351d79a77eb",
    "name": "Bel Radio Guadeloupe",
    "country": "GP",
    "url": "http://n06a-eu.rcs.revma.com/a7qacprtpwzuv?",
    "codec": "mp3",
    "bitrate": 0,
    "protocol": "http",
    "hls": false,
    "sources": [
      "radio-browser"
    ],
    "sourceIds": [
      "41b89a99-cae5-46b2-8a4c-a68bf46cc78c"
    ],
    "lastCheckOk": true,
    "lastCheckedAt": "2026-10-27T09:54:41Z"
  },
  {
    "id": "aws_31c4af5bb36c5bc5e2bd",
    "stationId": "awb_7f0bd584704364738b45",
    "name": "Chérie FM Guadeloupe",
    "country": "GP",
    "url": "https://maxxi.studio/listen/cheriefmgp/radio.mp3",
    "codec": "mp3",
    "bitrate": 192,
    "protocol": "https",
    "hls": false,
    "sources": [
      "radio-browser"
    ],
    "sourceIds": [
      "f7b9f37b-6a33-459d-af52-64186d805375"
    ],
    "lastCheckOk": true,
    "lastCheckedAt": "2026-10-27T18:14:34Z"
  },
  {
    "id": "aws_2550a871c3e1535ca42a",
    "stationId": "awb_af452aa0fded58fa262a",
    "name": "Guadeloupe 1ère",
    "country": "GP",
    "url": "https://guadeloupe.ice.infomaniak.ch/guadeloupe-128.mp3",
    "codec": "mp3",
    "bitrate": 128,
    "protocol": "https",
    "hls": false,
    "sources": [
      "radio-browser",
      "verified-radio-streams"
    ],
    "sourceIds": [
      "GP:guadeloupe-1ere",
      "ba41c7a6-d193-11e9-a861-52543be04c81"
    ],
    "lastCheckOk": true,
    "lastCheckedAt": "2026-10-27T10:06:03Z"
  },
  {
    "id": "aws_9efeeff7da0afd9f3f44",
    "stationId": "awb_edefc33ad3b307994f1d",
    "name": "Haute Tension",
    "country": "GP",
    "url": "https://haute-tension.ice.infomaniak.ch/haute-tension-high.mp3",
    "codec": "mp3",
    "bitrate": 128,
    "protocol": "https",
    "hls": false,
    "sources": [
      "radio-browser"
    ],
    "sourceIds": [
      "49d4d6ff-291b-4260-a756-d0cd1247207f"
    ],
    "lastCheckOk": true,
    "lastCheckedAt": "2026-10-27T15:34:30Z"
  },
  {
    "id": "aws_cee1ecedbc545a55d08d",
    "stationId": "awb_f535d320f5c90615ea57",
    "name": "Madras",
    "country": "GP",
    "url": "https://2stream.net/mfmradio-128",
    "codec": "mp3",
    "bitrate": 128,
    "protocol": "https",
    "hls": false,
    "sources": [
      "radio-browser"
    ],
    "sourceIds": [
      "fd44260b-6a5f-4bcf-80ff-35793f974e7c"
    ],
    "lastCheckOk": true,
    "lastCheckedAt": "2026-10-27T01:20:02Z"
  },
  {
    "id": "aws_4836d1d12b2f3b124f7a",
    "stationId": "awb_22be1464469abfd97e86",
    "name": "Massabielle",
    "country": "GP",
    "url": "https://radio.catholique-guadeloupe.org/radio-massabielle.mp3",
    "codec": "mp3",
    "bitrate": 100,
    "protocol": "https",
    "hls": false,
    "sources": [
      "radio-browser"
    ],
    "sourceIds": [
      "0c0c7618-cfbd-45a3-ae7b-3396a6c0652d"
    ],
    "lastCheckOk": true,
    "lastCheckedAt": "2026-10-26T21:56:12Z"
  },
  {
    "id": "aws_f20b41ba86f51efb679d",
    "stationId": "awb_d91902752368531edd02",
    "name": "MAXXI Guadeloupe",
    "country": "GP",
    "url": "https://maxxi.studio/listen/maxxigp/radio.mp3",
    "codec": "mp3",
    "bitrate": 128,
    "protocol": "https",
    "hls": false,
    "sources": [
      "radio-browser"
    ],
    "sourceIds": [
      "d887c971-8e8f-4818-8128-639f93b6cd14"
    ],
    "lastCheckOk": true,
    "lastCheckedAt": "2026-10-27T12:29:48Z"
  },
  {
    "id": "aws_2712b0167d28ded40788",
    "stationId": "awb_ee4ce1e1d94454645903",
    "name": "Nostalgie Guadeloupe",
    "country": "GP",
    "url": "http://go.2stream.net/nostalgiegp",
    "codec": "mp3",
    "bitrate": 128,
    "protocol": "http",
    "hls": false,
    "sources": [
      "radio-browser"
    ],
    "sourceIds": [
      "c3366c0f-2e83-430b-a277-dbd9501c4106",
      "ef88694d-2f20-477c-8b51-1eba54da6ed3"
    ],
    "lastCheckOk": true,
    "lastCheckedAt": "2026-10-27T06:44:24Z"
  },
  {
    "id": "aws_16aaf252d486f653a86c",
    "stationId": "awb_d275f1c36c5c7339e8c8",
    "name": "NRJ guadeloupe",
    "country": "GP",
    "url": "https://streaming.nrjaudio.fm/ou4w6dhtd2ko",
    "codec": "aac",
    "bitrate": 128,
    "protocol": "https",
    "hls": false,
    "sources": [
      "radio-browser"
    ],
    "sourceIds": [
      "4b337b11-44eb-4076-be7e-7f813492bd03"
    ],
    "lastCheckOk": true,
    "lastCheckedAt": "2026-10-27T03:24:22Z"
  },
  {
    "id": "aws_3fc8d8d7a9cdb909c343",
    "stationId": "awb_4525fba0e7ac9e467905",
    "name": "Radio Transat",
    "country": "GP",
    "url": "https://stream.rcs.revma.com/dy09pqzctwzuv",
    "codec": "mp3",
    "bitrate": 0,
    "protocol": "https",
    "hls": false,
    "sources": [
      "radio-browser"
    ],
    "sourceIds": [
      "de385096-3191-4fb4-a2ee-2bc03f3d7630"
    ],
    "lastCheckOk": true,
    "lastCheckedAt": "2026-10-26T22:33:07Z"
  },
  {
    "id": "aws_25cdb982b017934a2189",
    "stationId": "awb_16eaad97cfbe9acf8d5d",
    "name": "RCI guadeloupe",
    "country": "GP",
    "url": "https://n10-eu.rcs.revma.com/v4hf7bwspwzuv",
    "codec": "aac",
    "bitrate": 0,
    "protocol": "https",
    "hls": false,
    "sources": [
      "radio-browser"
    ],
    "sourceIds": [
      "6b0b20fc-386f-4842-a64f-558bb2b2a4f3"
    ],
    "lastCheckOk": true,
    "lastCheckedAt": "2026-10-27T06:25:50Z"
  },
  {
    "id": "aws_65b6ea72d9de9ffa3831",
    "stationId": "awb_7e922120041a4cfd2c36",
    "name": "Sofaia Altitude",
    "country": "GP",
    "url": "http://radiosofaia.ice.infomaniak.ch/radiosofaia-high.aac",
    "codec": "aac+",
    "bitrate": 64,
    "protocol": "http",
    "hls": false,
    "sources": [
      "radio-browser"
    ],
    "sourceIds": [
      "f3e64320-2d23-4568-921a-c89164fdec8a"
    ],
    "lastCheckOk": true,
    "lastCheckedAt": "2026-10-27T06:48:51Z"
  }
]
