[
  {
    "id": "aws_fe4f14bb76d1c551bc6c",
    "stationId": "awb_b9385b7e1e2a6fc88910",
    "name": "Abdulbasit Abdulsamad",
    "country": "FK",
    "url": "https://radio.mp3islam.com/listen/abdulbasit/radio.mp3",
    "codec": "aac",
    "bitrate": 192,
    "protocol": "https",
    "hls": false,
    "sources": [
      "radio-browser",
      "verified-radio-streams"
    ],
    "sourceIds": [
      "6cad9579-17eb-45a4-a885-562a28824029",
      "FK:abdulbasit-abdulsamad"
    ],
    "lastCheckOk": true,
    "lastCheckedAt": "2026-10-22T21:55:13Z"
  },
  {
    "id": "aws_f104bf959a76bc200ef6",
    "stationId": "awb_15c773c76699f1333d8c",
    "name": "BFBS Falklands",
    "country": "FK",
    "url": "https://listen-ssvcbfbs.sharp-stream.com/ssvcbfbs6.aac",
    "codec": "aac+",
    "bitrate": 64,
    "protocol": "https",
    "hls": false,
    "sources": [
      "radio-browser",
      "verified-radio-streams"
    ],
    "sourceIds": [
      "873e8220-51cd-43ca-96bd-6dcd09ecc884",
      "FK:bfbs-falklands"
    ],
    "lastCheckOk": true,
    "lastCheckedAt": "2026-10-22T19:56:35Z"
  },
  {
    "id": "aws_b1f351cf4f55543b3d45",
    "stationId": "awb_c82be4c49bd9e526edba",
    "name": "Falklands Radio",
    "country": "FK",
    "url": "http://streaming.broadcastradio.com:8330/flklnd",
    "codec": "mp3",
    "bitrate": 0,
    "protocol": "http",
    "hls": false,
    "sources": [
      "radio-browser"
    ],
    "sourceIds": [
      "a170dccb-c40f-11e9-8502-52543be04c81"
    ],
    "lastCheckOk": true,
    "lastCheckedAt": "2026-10-27T07:45:48Z"
  },
  {
    "id": "aws_61b11699147b5e879058",
    "stationId": "awb_c82be4c49bd9e526edba",
    "name": "Falklands Radio",
    "country": "FK",
    "url": "https://streaming.broadcastradio.com:8332/flklnd?1721893143541=",
    "codec": "mp3",
    "bitrate": 0,
    "protocol": "https",
    "hls": false,
    "sources": [
      "radio-browser",
      "verified-radio-streams"
    ],
    "sourceIds": [
      "FK:falklands-radio",
      "c7571d24-b6b2-43f4-b9ba-2e42a1cbc45e"
    ],
    "lastCheckOk": true,
    "lastCheckedAt": "2026-10-27T05:39:03Z"
  },
  {
    "id": "aws_3d891723ad98273aae3f",
    "stationId": "awb_652f1295423614235108",
    "name": "Falklands Radio 530 Stanley",
    "country": "FK",
    "url": "https://streaming.broadcastradio.com:8332/flklnd",
    "codec": "mp3",
    "bitrate": 0,
    "protocol": "https",
    "hls": false,
    "sources": [
      "radio-browser",
      "verified-radio-streams"
    ],
    "sourceIds": [
      "97887f52-540f-409e-a625-967e4698d829",
      "FK:falklands-radio-530-stanley"
    ],
    "lastCheckOk": true,
    "lastCheckedAt": "2026-10-22T19:54:26Z"
  }
]
