[
  {
    "id": "aws_78f7641188644600e6c8",
    "stationId": "awb_8aaea5e799b05304f005",
    "name": "Kalux FM Bamako",
    "country": "ML",
    "url": "http://stream.zeno.fm/kgadkjdbexqtv",
    "codec": "mp3",
    "bitrate": 128,
    "protocol": "http",
    "hls": false,
    "sources": [
      "radio-browser"
    ],
    "sourceIds": [
      "06636fc7-27d2-4e73-abd1-4f1222d030b4"
    ],
    "lastCheckOk": true,
    "lastCheckedAt": "2026-10-12T13:26:06Z"
  },
  {
    "id": "aws_81885864e1fa287a0a10",
    "stationId": "awb_ea681682da149ed7c7ab",
    "name": "Noura FM 94.5 Bamako",
    "country": "ML",
    "url": "https://stream-151.zeno.fm/60x209af8e9uv",
    "codec": "mp3",
    "bitrate": 128,
    "protocol": "https",
    "hls": false,
    "sources": [
      "radio-browser"
    ],
    "sourceIds": [
      "0b284362-d3e3-419c-a83d-01d5f5035f29"
    ],
    "lastCheckOk": true,
    "lastCheckedAt": "2026-10-17T01:14:00Z"
  },
  {
    "id": "aws_a258c676670790562d83",
    "stationId": "awb_89738712010f0d9620bf",
    "name": "Radio Bougouni Kunkan 102.9",
    "country": "ML",
    "url": "https://stream.zeno.fm/x3gb8t9nzk0uv",
    "codec": "mp3",
    "bitrate": 128,
    "protocol": "https",
    "hls": false,
    "sources": [
      "radio-browser"
    ],
    "sourceIds": [
      "9a708a2d-1410-4a25-981f-58c7ddfc1e71"
    ],
    "lastCheckOk": true,
    "lastCheckedAt": "2026-10-17T04:49:21Z"
  },
  {
    "id": "aws_35028f8b335a426b3eba",
    "stationId": "awb_cc4fbe201c98a205dd34",
    "name": "Radio Fréquence 3 93.8 Bamako",
    "country": "ML",
    "url": "http://ice.stream.frequence3.net/frequence3-64.aac",
    "codec": "aac",
    "bitrate": 64,
    "protocol": "http",
    "hls": false,
    "sources": [
      "radio-browser"
    ],
    "sourceIds": [
      "64fa4823-9847-4fc2-be16-dcf2c36a5f27"
    ],
    "lastCheckOk": true,
    "lastCheckedAt": "2026-10-12T09:02:21Z"
  },
  {
    "id": "aws_c7a3143e80cec0359fa6",
    "stationId": "awb_5eea43791ca08d1dd8c8",
    "name": "Radio Kassara Barikama 107.4 Kayes",
    "country": "ML",
    "url": "https://stream.zeno.fm/0ef19uaxh4duv",
    "codec": "mp3",
    "bitrate": 64,
    "protocol": "https",
    "hls": false,
    "sources": [
      "radio-browser"
    ],
    "sourceIds": [
      "f044deeb-3357-4b54-89fc-8eddae045794"
    ],
    "lastCheckOk": true,
    "lastCheckedAt": "2026-10-12T09:31:22Z"
  },
  {
    "id": "aws_a8063fcab07339b81380",
    "stationId": "awb_ec397ff64c588c5eb318",
    "name": "Radio Kledu",
    "country": "ML",
    "url": "https://stream.zeno.fm/f38bxpt3v2quv",
    "codec": "mp3",
    "bitrate": 128,
    "protocol": "https",
    "hls": false,
    "sources": [
      "radio-browser"
    ],
    "sourceIds": [
      "880cb524-8432-48d0-adf3-be96949c0171"
    ],
    "lastCheckOk": true,
    "lastCheckedAt": "2026-10-16T21:35:26Z"
  },
  {
    "id": "aws_1b570dbb028aa9067be7",
    "stationId": "awb_3da3a67532ed7bb92a29",
    "name": "Radio Kledu 101.2",
    "country": "ML",
    "url": "https://stream-156.zeno.fm/yerp85sughwtv",
    "codec": "mp3",
    "bitrate": 128,
    "protocol": "https",
    "hls": false,
    "sources": [
      "radio-browser"
    ],
    "sourceIds": [
      "a0d534ad-4446-4a5e-bf03-b5b16ad49223"
    ],
    "lastCheckOk": true,
    "lastCheckedAt": "2026-10-12T15:18:00Z"
  },
  {
    "id": "aws_b134c8d28edebac85846",
    "stationId": "awb_9e40b16ee8f340ee0614",
    "name": "Radio Madjoura Nourou Dine Touba",
    "country": "ML",
    "url": "https://stream.zeno.fm/kgnvaarqu0quv",
    "codec": "mp3",
    "bitrate": 128,
    "protocol": "https",
    "hls": false,
    "sources": [
      "radio-browser"
    ],
    "sourceIds": [
      "cf25b2c3-7ae9-4f34-be73-6c75a1ffb36b"
    ],
    "lastCheckOk": true,
    "lastCheckedAt": "2026-10-17T05:06:07Z"
  },
  {
    "id": "aws_1e6ee7a5080296279b86",
    "stationId": "awb_1f070f3c3ff6f820efd0",
    "name": "Radio Malijet",
    "country": "ML",
    "url": "https://stream-157.zeno.fm/yerp85sughwtv?zs=bzqHawb1Rha3gGg97iW8xg",
    "codec": "mp3",
    "bitrate": 128,
    "protocol": "https",
    "hls": false,
    "sources": [
      "radio-browser"
    ],
    "sourceIds": [
      "f63b80ba-b74b-4fd9-83a0-8510de2ed3b3"
    ],
    "lastCheckOk": true,
    "lastCheckedAt": "2026-10-12T12:47:09Z"
  },
  {
    "id": "aws_940b1bf54cdacf2b6d36",
    "stationId": "awb_a69d6e11512de91f7f09",
    "name": "Radio Neneba FM 97.7 Markala",
    "country": "ML",
    "url": "https://stream.zeno.fm/e9xqg1ah22quv",
    "codec": "mp3",
    "bitrate": 128,
    "protocol": "https",
    "hls": false,
    "sources": [
      "radio-browser"
    ],
    "sourceIds": [
      "96db7462-a558-4d0f-8c4a-d23fe97bf86c"
    ],
    "lastCheckOk": true,
    "lastCheckedAt": "2026-10-12T11:09:54Z"
  },
  {
    "id": "aws_2bf6d13cee3e73966953",
    "stationId": "awb_3c81a851de7956c5b413",
    "name": "Radio Tissa la Voix du Mamelon 99.7 FM",
    "country": "ML",
    "url": "https://stream.zeno.fm/s8ng63k4tchvv",
    "codec": "mp3",
    "bitrate": 128,
    "protocol": "https",
    "hls": false,
    "sources": [
      "radio-browser"
    ],
    "sourceIds": [
      "0a92f8b1-64c5-446c-8a54-10081479ec27"
    ],
    "lastCheckOk": true,
    "lastCheckedAt": "2026-10-12T11:35:53Z"
  },
  {
    "id": "aws_088b8d90d62020692642",
    "stationId": "awb_3b4051e6c64b703bbe1e",
    "name": "Radio Woyowayanko 93.0 Bamako",
    "country": "ML",
    "url": "https://stream.zeno.fm/1mr8wdywz68uv",
    "codec": "mp3",
    "bitrate": 128,
    "protocol": "https",
    "hls": false,
    "sources": [
      "radio-browser"
    ],
    "sourceIds": [
      "1d074522-d5a3-4c63-87fc-0e4b650db095"
    ],
    "lastCheckOk": true,
    "lastCheckedAt": "2026-10-12T15:45:19Z"
  },
  {
    "id": "aws_a7519698c6d6c367494a",
    "stationId": "awb_f7629a93f9e1c837cf91",
    "name": "Radio Yélé Sagabali La Voix Du Beledougou",
    "country": "ML",
    "url": "https://stream-286.surfernetwork.com/au9gskurq0hvv?zt=eyJhbGciOiJIUzI1NiJ9.eyJzdHJlYW0iOiJhdTlnc2t1cnEwaHZ2IiwiaG9zdCI6InN0cmVhbS0yODYuc3VyZmVybmV0d29yay5jb20iLCJ0bSI6ZmFsc2UsInJ0dGwiOjUsImp0aSI6Il9mYV9MYWp4UkhtZjdrZWVkS0VlblEiLCJpYXQiOjE3OTIyMTIyMDAsImV4cCI6MTc5MjIxMjI2MH0.F71xQMis7rXPZo0XO-pDZ3V-kl-gEx6Q_QvCqRU-uUI",
    "codec": "mp3",
    "bitrate": 128,
    "protocol": "https",
    "hls": false,
    "sources": [
      "radio-browser"
    ],
    "sourceIds": [
      "5efb9d57-8e95-4452-9a6b-745ee93bca02"
    ],
    "lastCheckOk": true,
    "lastCheckedAt": "2026-10-17T04:45:00Z"
  }
]
