[
  {
    "id": "aws_7769d4ce9a238d1cb5d1",
    "stationId": "awb_c91bac696b57e3cdfb83",
    "name": "Abdulbasit Abdulsamad",
    "country": "NU",
    "url": "https://radio.mp3islam.com/listen/abdulbasit/radio.mp3",
    "codec": "aac",
    "bitrate": 64,
    "protocol": "https",
    "hls": false,
    "sources": [
      "radio-browser"
    ],
    "sourceIds": [
      "b626bc7f-7ab0-493e-b806-8742e7d0bd3a"
    ],
    "lastCheckOk": true,
    "lastCheckedAt": "2026-10-22T05:48:41Z"
  },
  {
    "id": "aws_c7b3fcab02ef73a4e21f",
    "stationId": "awb_def7b2d55e56885fb438",
    "name": "MaXXima",
    "country": "NU",
    "url": "http://maxxima.mine.nu:8000/maxx.ogg",
    "codec": "ogg",
    "bitrate": 700,
    "protocol": "http",
    "hls": false,
    "sources": [
      "radio-browser"
    ],
    "sourceIds": [
      "0a1e2c11-4bac-4042-9a65-40c9bfde50b9"
    ],
    "lastCheckOk": true,
    "lastCheckedAt": "2026-10-17T08:31:43Z"
  }
]
