[
  {
    "id": "aws_01eb7bedb4f8650072c8",
    "stationId": "awb_dfad47b1fa4079d13077",
    "name": "Abdulbasit Abdulsamad",
    "country": "KP",
    "url": "https://radio.mp3islam.com/listen/abdulbasit/radio.mp3",
    "codec": "aac",
    "bitrate": 192,
    "protocol": "https",
    "hls": false,
    "sources": [
      "radio-browser",
      "verified-radio-streams"
    ],
    "sourceIds": [
      "1cacb1d5-e646-4d3b-a7dd-27aa9a0add47",
      "KP:abdulbasit-abdulsamad"
    ],
    "lastCheckOk": true,
    "lastCheckedAt": "2026-10-12T16:10:31Z"
  },
  {
    "id": "aws_b4fbe42d86015032625a",
    "stationId": "awb_3ed0d2ad2a58e36ccde5",
    "name": "KCBS 조선중앙방송",
    "country": "KP",
    "url": "https://stream.intchoson.com/kcbs/main_stream.m3u8",
    "codec": "unknown",
    "bitrate": 0,
    "protocol": "https",
    "hls": true,
    "sources": [
      "radio-browser"
    ],
    "sourceIds": [
      "8d95cf64-8fce-4b71-b9e6-8e1e2d2fc00d"
    ],
    "lastCheckOk": true,
    "lastCheckedAt": "2026-10-12T13:32:56Z"
  },
  {
    "id": "aws_29f22440698b4e2ac5c7",
    "stationId": "awb_25e5017eaf264503b8d1",
    "name": "Pyongyang",
    "country": "KP",
    "url": "https://listen7.myradio24.com/69366",
    "codec": "mp3",
    "bitrate": 128,
    "protocol": "https",
    "hls": false,
    "sources": [
      "radio-browser"
    ],
    "sourceIds": [
      "a0208db2-3e15-4ce9-9a18-d71c3d789025"
    ],
    "lastCheckOk": true,
    "lastCheckedAt": "2026-10-17T05:32:46Z"
  },
  {
    "id": "aws_00e39b10ec37a3475d8b",
    "stationId": "awb_a0179cf8792f4ae32f55",
    "name": "Pyongyang FM Radio",
    "country": "KP",
    "url": "http://myradio24.org/69366",
    "codec": "mp3",
    "bitrate": 128,
    "protocol": "http",
    "hls": false,
    "sources": [
      "radio-browser"
    ],
    "sourceIds": [
      "7471224a-fae1-4324-a912-6585db34fd7b"
    ],
    "lastCheckOk": true,
    "lastCheckedAt": "2026-10-17T06:57:33Z"
  },
  {
    "id": "aws_25ebd418ac19dbf1bb93",
    "stationId": "awb_b660bc01f9a680dc858c",
    "name": "Pyongyang Radio FM",
    "country": "KP",
    "url": "https://listen7.myradio24.com/69366",
    "codec": "mp3",
    "bitrate": 128,
    "protocol": "https",
    "hls": false,
    "sources": [
      "radio-browser",
      "verified-radio-streams"
    ],
    "sourceIds": [
      "2d8ae9e8-d207-44fe-8a35-196388626837",
      "KP:pyongyang-radio-fm"
    ],
    "lastCheckOk": true,
    "lastCheckedAt": "2026-10-16T21:46:33Z"
  },
  {
    "id": "aws_ce65645d4001b9cf40d2",
    "stationId": "awb_d495183710d5afa907a6",
    "name": "Voice of Chongro",
    "country": "KP",
    "url": "https://stream.zeno.fm/oldwnjuma3duv",
    "codec": "mp3",
    "bitrate": 128,
    "protocol": "https",
    "hls": false,
    "sources": [
      "radio-browser"
    ],
    "sourceIds": [
      "0a83de69-837b-4a24-8e59-dbe87dc75c9f"
    ],
    "lastCheckOk": true,
    "lastCheckedAt": "2026-10-12T10:11:28Z"
  },
  {
    "id": "aws_77f2363c358568eecbe5",
    "stationId": "awb_b1381ec3f2ea55bbbd61",
    "name": "Voice of Korea",
    "country": "KP",
    "url": "https://listen7.myradio24.com/69366",
    "codec": "mp3",
    "bitrate": 128,
    "protocol": "https",
    "hls": false,
    "sources": [
      "radio-browser"
    ],
    "sourceIds": [
      "9cc87217-fc59-4335-a7d7-050407527f9a"
    ],
    "lastCheckOk": true,
    "lastCheckedAt": "2026-10-12T09:02:21Z"
  },
  {
    "id": "aws_3dee85e70c562630a960",
    "stationId": "awb_13c44d8be199898e727e",
    "name": "Voice of Korea (Russian)",
    "country": "KP",
    "url": "https://listen4.myradio24.com/60315",
    "codec": "mp3",
    "bitrate": 320,
    "protocol": "https",
    "hls": false,
    "sources": [
      "radio-browser",
      "verified-radio-streams"
    ],
    "sourceIds": [
      "KP:voice-of-korea-russian",
      "f4d082ad-d030-4a17-8467-7f9b99f4ce2d"
    ],
    "lastCheckOk": true,
    "lastCheckedAt": "2026-10-12T13:10:26Z"
  },
  {
    "id": "aws_91653261917cde0b21cf",
    "stationId": "awb_70c689f979d2ed2fb0c0",
    "name": "Voice of Korea 조선의 소리 방송",
    "country": "KP",
    "url": "https://stream.intchoson.com/vok/main_stream.m3u8",
    "codec": "unknown",
    "bitrate": 0,
    "protocol": "https",
    "hls": true,
    "sources": [
      "radio-browser"
    ],
    "sourceIds": [
      "734f76f0-00b8-424c-9ec9-38e11f052141"
    ],
    "lastCheckOk": true,
    "lastCheckedAt": "2026-10-17T05:32:46Z"
  },
  {
    "id": "aws_f0f353492a151aa8a97d",
    "stationId": "awb_e80a49e33132731e5af5",
    "name": "Голос Корей",
    "country": "KP",
    "url": "https://listen4.myradio24.com/60315",
    "codec": "mp3",
    "bitrate": 320,
    "protocol": "https",
    "hls": false,
    "sources": [
      "radio-browser"
    ],
    "sourceIds": [
      "238f1b0e-758a-4ee8-bbe2-7fe81bf3c43e"
    ],
    "lastCheckOk": true,
    "lastCheckedAt": "2026-10-12T17:12:16Z"
  },
  {
    "id": "aws_5926f248281d15765171",
    "stationId": "awb_2e9c2b80a3eb948bc86c",
    "name": "조선의 소리 방송 Voice of Korea",
    "country": "KP",
    "url": "https://stream.intchoson.com/vok/main_stream.m3u8",
    "codec": "unknown",
    "bitrate": 0,
    "protocol": "https",
    "hls": true,
    "sources": [
      "radio-browser"
    ],
    "sourceIds": [
      "a4ee7325-58ef-4922-8a26-7837b1ce8fa7"
    ],
    "lastCheckOk": true,
    "lastCheckedAt": "2026-10-12T17:29:40Z"
  },
  {
    "id": "aws_4de078754a46ebdb7483",
    "stationId": "awb_5b8ff512beb6140bf017",
    "name": "평양FM105.2",
    "country": "KP",
    "url": "http://listen7.myradio24.com/69366",
    "codec": "mp3",
    "bitrate": 128,
    "protocol": "http",
    "hls": false,
    "sources": [
      "radio-browser"
    ],
    "sourceIds": [
      "be116145-ad80-4656-b45f-6e1ce4231ec5"
    ],
    "lastCheckOk": true,
    "lastCheckedAt": "2026-10-17T02:22:19Z"
  }
]
