[
  {
    "id": "aws_9cbd63d426459032c56e",
    "stationId": "awb_9731131122763de748e2",
    "name": "Abdulbasit Abdulsamad",
    "country": "MU",
    "url": "https://radio.mp3islam.com/listen/abdulbasit/radio.mp3",
    "codec": "aac",
    "bitrate": 192,
    "protocol": "https",
    "hls": false,
    "sources": [
      "radio-browser",
      "verified-radio-streams"
    ],
    "sourceIds": [
      "1edd160a-bc68-44f0-b276-030b699f5cb7",
      "MU:abdulbasit-abdulsamad"
    ],
    "lastCheckOk": true,
    "lastCheckedAt": "2026-10-12T14:04:43Z"
  },
  {
    "id": "aws_e2c69e179d601f2cf2fe",
    "stationId": "awb_85664162ab88967bdbf5",
    "name": "MBC Best FM",
    "country": "MU",
    "url": "https://radio.mbconline.xyz/hls/bestfm.m3u8",
    "codec": "unknown",
    "bitrate": 0,
    "protocol": "https",
    "hls": true,
    "sources": [
      "radio-browser"
    ],
    "sourceIds": [
      "3c1ee308-0937-4a27-84fc-bc53cc36297e"
    ],
    "lastCheckOk": true,
    "lastCheckedAt": "2026-10-16T23:32:22Z"
  },
  {
    "id": "aws_4107b471b46ea0c56a21",
    "stationId": "awb_ef75d7d963bf23a82ed4",
    "name": "MBC Kool FM",
    "country": "MU",
    "url": "https://radio.mbconline.xyz/hls/koolfm.m3u8",
    "codec": "unknown",
    "bitrate": 0,
    "protocol": "https",
    "hls": true,
    "sources": [
      "radio-browser"
    ],
    "sourceIds": [
      "adb22f44-ff89-43ae-8406-6632c85298d0"
    ],
    "lastCheckOk": true,
    "lastCheckedAt": "2026-10-12T20:30:46Z"
  },
  {
    "id": "aws_141c19057d1807d2cadc",
    "stationId": "awb_9034538c09d76e00e6de",
    "name": "MBC Radio Maurice",
    "country": "MU",
    "url": "https://radio.mbconline.xyz/hls/radiomaurice.m3u8",
    "codec": "unknown",
    "bitrate": 0,
    "protocol": "https",
    "hls": true,
    "sources": [
      "radio-browser"
    ],
    "sourceIds": [
      "e3cea313-4aa9-4ac5-a053-50d7e82326f4"
    ],
    "lastCheckOk": true,
    "lastCheckedAt": "2026-10-12T08:08:26Z"
  },
  {
    "id": "aws_1375eee713938c1514f9",
    "stationId": "awb_e36d22d3b68631fc582c",
    "name": "MBC Radio Mauritius",
    "country": "MU",
    "url": "https://radio.mbconline.xyz/hls/radiomauritus.m3u8",
    "codec": "unknown",
    "bitrate": 0,
    "protocol": "https",
    "hls": true,
    "sources": [
      "radio-browser"
    ],
    "sourceIds": [
      "cfe17287-cabe-4484-b05a-a935e4444d1c"
    ],
    "lastCheckOk": true,
    "lastCheckedAt": "2026-10-16T22:48:33Z"
  },
  {
    "id": "aws_b94c93bd2904a8c4c174",
    "stationId": "awb_622410828f3435e86ed0",
    "name": "MBC Taal FM",
    "country": "MU",
    "url": "https://radio.mbconline.xyz/hls/tallfm.m3u8",
    "codec": "unknown",
    "bitrate": 0,
    "protocol": "https",
    "hls": true,
    "sources": [
      "radio-browser"
    ],
    "sourceIds": [
      "abcd1a7b-8b0a-4bc4-a8c4-4a02352760a6"
    ],
    "lastCheckOk": true,
    "lastCheckedAt": "2026-10-12T11:15:00Z"
  },
  {
    "id": "aws_9055e68d06595b6b1381",
    "stationId": "awb_a0a9d18d30035b3153a9",
    "name": "OUi Radio",
    "country": "MU",
    "url": "https://mu1stream.mushost.com:8443/",
    "codec": "mp3",
    "bitrate": 128,
    "protocol": "https",
    "hls": false,
    "sources": [
      "radio-browser"
    ],
    "sourceIds": [
      "d7c6d471-0e42-4f73-8c2b-4c4203227d0e"
    ],
    "lastCheckOk": true,
    "lastCheckedAt": "2026-10-17T04:19:36Z"
  },
  {
    "id": "aws_40ff316ba34beddcd648",
    "stationId": "awb_407947f52dc5d33445fb",
    "name": "OUi Radio Rodrigues",
    "country": "MU",
    "url": "https://mu1stream.mushost.com:8554/",
    "codec": "mp3",
    "bitrate": 128,
    "protocol": "https",
    "hls": false,
    "sources": [
      "radio-browser"
    ],
    "sourceIds": [
      "385b3d31-8952-464f-a1f1-a86b68d3c35e",
      "91be8181-df6c-4874-8f1a-dabd6fdc943e"
    ],
    "lastCheckOk": true,
    "lastCheckedAt": "2026-10-17T06:11:36Z"
  },
  {
    "id": "aws_504738726c2fb38524e4",
    "stationId": "awb_c5e2304034a23e9a57a6",
    "name": "Radio 7 Mauritius",
    "country": "MU",
    "url": "https://c2.radioboss.fm/stream/1056",
    "codec": "mp3",
    "bitrate": 128,
    "protocol": "https",
    "hls": false,
    "sources": [
      "radio-browser",
      "verified-radio-streams"
    ],
    "sourceIds": [
      "78a48ab1-6e15-4331-8378-e1a9a97459d1",
      "MU:radio-7-mauritius"
    ],
    "lastCheckOk": true,
    "lastCheckedAt": "2026-10-12T11:40:19Z"
  },
  {
    "id": "aws_8d358b69c5f2fd0b9405",
    "stationId": "awb_10d83bdfa732056cf2eb",
    "name": "Radio One",
    "country": "MU",
    "url": "https://centova57.instainternet.com/proxy/vivavoceltd?mp=/stream",
    "codec": "mp3",
    "bitrate": 128,
    "protocol": "https",
    "hls": false,
    "sources": [
      "radio-browser",
      "verified-radio-streams"
    ],
    "sourceIds": [
      "8b99281f-5cc6-4a2e-85db-012e4ca685ce",
      "MU:radio-one"
    ],
    "lastCheckOk": true,
    "lastCheckedAt": "2026-10-12T07:55:27Z"
  },
  {
    "id": "aws_ca6980dae1106de42394",
    "stationId": "awb_d75445c564c1ae003afc",
    "name": "Radio Plus - Indiz",
    "country": "MU",
    "url": "https://streamer.radio.co/sed5c5a375/listen",
    "codec": "mp3",
    "bitrate": 128,
    "protocol": "https",
    "hls": false,
    "sources": [
      "radio-browser",
      "verified-radio-streams"
    ],
    "sourceIds": [
      "3447ded9-0b52-4f59-ad6b-d1a7259fdf28",
      "MU:radio-plus-indiz"
    ],
    "lastCheckOk": true,
    "lastCheckedAt": "2026-10-17T02:20:29Z"
  },
  {
    "id": "aws_0ad47e8a02c7b7b67cbb",
    "stationId": "awb_9faa7993c12a2b6bb082",
    "name": "Radio Plus Mauritius",
    "country": "MU",
    "url": "https://stream.radioplus.mu:8000/radio.mp3",
    "codec": "mp3",
    "bitrate": 128,
    "protocol": "https",
    "hls": false,
    "sources": [
      "radio-browser",
      "verified-radio-streams"
    ],
    "sourceIds": [
      "961a681b-0601-11e8-ae97-52543be04c81",
      "MU:radio-plus-mauritius"
    ],
    "lastCheckOk": true,
    "lastCheckedAt": "2026-10-12T19:59:01Z"
  },
  {
    "id": "aws_198656c07794518c6bf6",
    "stationId": "awb_527f5c736ad758805ed2",
    "name": "Radioplus Fever",
    "country": "MU",
    "url": "https://streamer.radio.co/s3fe39a4a4/listen",
    "codec": "mp3",
    "bitrate": 128,
    "protocol": "https",
    "hls": false,
    "sources": [
      "radio-browser",
      "verified-radio-streams"
    ],
    "sourceIds": [
      "MU:radioplus-fever",
      "beb06313-7d5c-4627-8360-f14b68e0e83d"
    ],
    "lastCheckOk": true,
    "lastCheckedAt": "2026-10-12T10:14:21Z"
  },
  {
    "id": "aws_377e7a03ff6eac434c22",
    "stationId": "awb_bd4acdc2f9dea1067861",
    "name": "SENSUELLE RADIO",
    "country": "MU",
    "url": "https://forwardmystream.com/sensuelleradio",
    "codec": "mp3",
    "bitrate": 320,
    "protocol": "https",
    "hls": false,
    "sources": [
      "radio-browser",
      "verified-radio-streams"
    ],
    "sourceIds": [
      "464fc4cc-3c6e-4b5d-92a8-9e4646c2f1da",
      "MU:sensuelle-radio"
    ],
    "lastCheckOk": true,
    "lastCheckedAt": "2026-10-12T15:54:18Z"
  },
  {
    "id": "aws_83fc6f5a13ba7c5f0e9f",
    "stationId": "awb_abf4df6e3512e4c45862",
    "name": "Tamizen",
    "country": "MU",
    "url": "https://c34.radioboss.fm:18023/stream",
    "codec": "mp3",
    "bitrate": 192,
    "protocol": "https",
    "hls": false,
    "sources": [
      "radio-browser",
      "verified-radio-streams"
    ],
    "sourceIds": [
      "9cae78d5-3341-4e29-ab1d-9aa9915b8cc4",
      "MU:tamizen"
    ],
    "lastCheckOk": true,
    "lastCheckedAt": "2026-10-16T21:32:34Z"
  }
]
